favorite_count,source,text,in_reply_to_screen_name,is_retweet,created_at,retweet_count,id_str
52,Twitter Web Client,https://t.co/7Fhm7hDB7q,exxonmobil,False,Mon Jun 25 17:32:22 +0000 2018,8,1011301083807977472
241,Twitter Web Client,How long will U.S. #naturalgas reserves last? Well into the next century. https://t.co/mWOzozmXyJ,,False,Thu Aug 09 15:51:57 +0000 2018,54,1027583266742775809
60,Twitter Web Client,Here are a few pics of employees at the Houston Pride Parade https://t.co/mcEDNpsEgv,exxonmobil,False,Mon Jun 25 17:32:21 +0000 2018,16,1011301080293101570
43,Twitter for iPhone,“Gas is the obvious partner for renewables to make sure the energy is accessible when needed – cleaner than coal an… https://t.co/OHak0SXgSi,,False,Wed Jun 27 17:31:43 +0000 2018,29,1012025697420881920
67,Twitter Web Client,"We continue celebrating #boundarybreaking engineers like Britney – an air and greenhouse gas advisor. Thank you, Br… https://t.co/uG9j0u35zc",,False,Thu Oct 18 15:36:52 +0000 2018,14,1052946622819262466
294,Twitter Web Client,#DYK liquefied natural gas takes up 1/600 the space of natural gas? That’s like shrinking a beach ball to the size… https://t.co/6W47Da4EIM,,False,Tue Sep 18 15:07:50 +0000 2018,73,1042067679757180930
110,Twitter Web Client,"Holiday preparation requires lots of energy. So, while making dinner this holiday, ask yourself – just how much ene… https://t.co/l98Gg22ryg",,False,Wed Nov 21 14:14:19 +0000 2018,24,1065247037833252864
91,Twitter Web Client,"""We all have a responsibility...to keep improving our operational performance. We have to come together to advocate… https://t.co/kFR4Tyowy4",,False,Mon Jun 25 18:43:17 +0000 2018,29,1011318931100000256
268,Twitter Web Client,"Our New Mexico investments will result in $64 billion for the state and 4,100 direct jobs per year for the next 40… https://t.co/LZBB6TZ82B",,False,Fri May 17 14:07:53 +0000 2019,68,1129388071831691264
118,Twitter Web App,"“We are making excellent progress on our long-term growth strategy.” — Darren W. Woods, chairman and CEO. Read the… https://t.co/6MLUaaxgze",,False,Fri Nov 01 15:29:23 +0000 2019,26,1190289742589497344
244,Twitter Web Client,Today we announced a new facility expansion in Baton Rouge expected to create up to 600 jobs during construction as… https://t.co/S3ZiRpjFHz,,False,Fri Mar 01 18:05:15 +0000 2019,57,1101543941055369216
12,Twitter for iPhone,"“We’re working on potential technology breakthroughs that provide reliable, affordable and cleaner energy, on deman… https://t.co/88Vb9PFkkY",,False,Wed May 29 14:43:43 +0000 2019,9,1133745740948418560
208,Twitter Web Client,"Today, we celebrate the women of ExxonMobil who are driving innovation and inspiring the next generation of STEM le… https://t.co/qAUGHgdbkq",,False,Sat Jun 23 14:07:02 +0000 2018,69,1010524636507983872
294,Twitter Web Client,"The Permian Basin is the country’s highest producing oil field. See why operations engineering manager, Jack Mohr,… https://t.co/ExB3RjapQK",,False,Tue May 14 16:58:31 +0000 2019,60,1128343848109924352
372,Twitter Web Client,"We’ve made our ninth oil discovery in offshore Guyana at the Hammerhead-1 well, making it our fifth discovery on th… https://t.co/tJrkH6NGPj",,False,Thu Aug 30 13:08:24 +0000 2018,148,1035152257082449922
15,Twitter for iPhone,“ExxonMobil joined the oil and gas climate initiative and continued our work in support of a carbon tax. In an impo… https://t.co/GMINzMFCJ6,,False,Wed May 29 14:42:16 +0000 2019,10,1133745375012118528
112,Twitter Web Client,"Did you know ExxonMobil has a wildlife habitat team? Meet team member Tara Bazille, who plants trees with local chi… https://t.co/QywJTrR0fN",,False,Fri Jan 25 16:01:30 +0000 2019,28,1088829220103639041
163,Twitter Web Client,ExxonMobil employees around the world participate in Pride events this time of year. ExxonMobil’s employee PRIDE ne… https://t.co/EudGzFshmC,,False,Mon Jun 25 14:41:45 +0000 2018,43,1011258146826936321
111,Twitter Web Client,#DYK liquefied natural gas takes up 1/600 the space of natural gas? That’s like shrinking a beach ball to the size… https://t.co/M2Kghmt0UQ,,False,Thu Dec 27 15:31:28 +0000 2018,34,1078312415463436289
74,Twitter Web App,"Pencils down, toys out. Join us for a speedy science lesson on how lubricants help race cars go fast with our motor… https://t.co/GOgCk9Wd0j",,False,Thu Aug 15 15:07:20 +0000 2019,25,1162017939706589184
184,Twitter Web Client,"Working with @SynGenomeInc, researchers at our Corporate Strategic Research Lab have entered the next phase in thei… https://t.co/1PyLvV1Swv",,False,Fri Sep 07 18:28:51 +0000 2018,38,1038132002069925888
139,Twitter Web Client,"When we turn our clocks back for #DaylightSaving, how much energy do we really save? It’s the energy equivalent to… https://t.co/gSjXgs5jYf",,False,Sun Nov 04 15:08:54 +0000 2018,51,1059100179901673481
21,Twitter for iPhone,"""Energy underpins almost every aspect of our daily lives, providing light and heat for homes and schools, broadenin… https://t.co/jkh6xQu7cJ",,False,Wed May 29 14:44:11 +0000 2019,15,1133745859051573248
35,Twitter Web Client,"We are committed to supporting research at our 80+ university partners, including the @AndlingerCenter at… https://t.co/W1er7SLk3P",,False,Fri Jan 25 20:09:19 +0000 2019,5,1088891588082917377
196,Twitter Web Client,"The 50th anniversary celebration of our Corporate Strategic Research Lab continues with the Nebula catalyst, discov… https://t.co/OdPNjWp70c",,False,Wed Sep 05 16:05:37 +0000 2018,43,1037371179714203648
61,Twitter Web App,With our partners at @clariant and @Genomatica we’re researching ways to give agricultural waste a second life by t… https://t.co/jO4yML4OGn,,False,Mon Nov 04 17:00:23 +0000 2019,17,1191399804682801154
129,Twitter Web Client,"Challenge accepted, @BCG Rich Lesser. Here's how ExxonMobil is #EmbracingSustainability. Now I challenge Doug Peter… https://t.co/vkrBbfYSlw",,False,Mon Oct 22 13:45:20 +0000 2018,48,1054368107882520576
376,Twitter Web App,"Welcome to the Liza Destiny, a vessel built on innovation set to transform Guyana into an energy powerhouse. https://t.co/eE7jq4ze1U",,False,Fri Sep 06 14:31:42 +0000 2019,122,1169981502312132608
79,Twitter Web Client,"Today, we announced the start of development drilling at our Liza Phase 1 development in offshore Guyana. 17 wells… https://t.co/rGv0dZl2sR",,False,Tue Jun 12 13:08:27 +0000 2018,40,1006523624428376064
22,Twitter for iPhone,"""We work on breakthrough technologies to fill the void in today’s solution set ... such as next-generation biofuels… https://t.co/31DLBZ5Ezo",,False,Wed May 29 14:45:14 +0000 2019,12,1133746124022603776
219,Twitter Web Client,Our new partnership with @Microsoft uses cloud technology that collects real-time data across hundreds of miles. Th… https://t.co/TcVkZX0Yh9,,False,Fri Feb 22 17:00:21 +0000 2019,81,1098990892885643265
87,Twitter Web Client,"Find out what Jing Ning, XTO operations engineer, loves most about her job in the Permian Basin. https://t.co/gUVoUTnl6N",,False,Thu Jul 11 14:21:02 +0000 2019,19,1149322713712013312
141,Twitter Web Client,"XTO has close to 800 employees in the Permian Basin. See how Claire Lafferty, operations engineer, is passionate ab… https://t.co/iRfLK9BP50",,False,Tue Jun 11 15:41:51 +0000 2019,28,1138471413998915591
123,Twitter Web Client,"This National Safety Month, take a look at why safety for our employees is our top priority. https://t.co/Z7nCO3YR7O",,False,Fri Jun 14 18:54:01 +0000 2019,35,1139606939594305538
96,Twitter Web App,"Our butyl rubber keeps tires inflated longer, so this video could go on forever. #SoothingScience https://t.co/lPrEcf7xcO",,False,Thu Jul 25 14:35:42 +0000 2019,15,1154399833224077313
170,Twitter Web App,We’re making our first entry into electric motorsports by providing high-performance lubricants and fluids for Pors… https://t.co/AIJO4HHqjb,,False,Mon Sep 09 13:35:33 +0000 2019,41,1171054535512604672
264,Twitter Web Client,"How do algae grow differently from plants? They thrive in salty water, a condition ideal for turning algae into a l… https://t.co/XWrAz4cohc",,False,Tue Nov 13 14:54:28 +0000 2018,69,1062358035853664257
143,Twitter Web Client,Carbon capture and storage (CCS) takes CO2 from the atmosphere and stores it underground. See how this technology i… https://t.co/Hzr1qk3sHe,,False,Wed Mar 27 14:30:13 +0000 2019,66,1110911909073686528
121,Twitter Web Client,.@ImperialOil to apply new technologies to reduce greenhouse gas emissions intensity. https://t.co/D9uYGfhKDd https://t.co/AFtwW7gn7o,,False,Tue Aug 28 18:47:47 +0000 2018,32,1034512888566898689
187,Twitter Web Client,"Our fuel-saving technologies like synthetic lubricants, tire-liners and advanced plastics add up to huge savings at… https://t.co/kJgvqxQ7yx",,False,Fri Aug 10 16:30:43 +0000 2018,45,1027955413541638144
61,Twitter Web Client,"Things get a little thicker during the winter, including your motor oil. Here’s how @Mobil1 Annual Protection’s syn… https://t.co/IRa2bj0VGH",,False,Thu Jan 10 15:01:54 +0000 2019,23,1083378404324458496
491,Twitter Web App,The global population is projected to grow from 7.5 billion to 9.2 billion by 2040. How will this affect energy dem… https://t.co/RtEY3NJUIO,,False,Wed Aug 28 12:44:51 +0000 2019,151,1166693125798150145
85,Twitter Web Client,"We’re at #Think2019 this week, where our own Devin Miller discussed our journey with @IBM to provide a better exper… https://t.co/5PoFrovPJl",,False,Fri Feb 15 15:52:09 +0000 2019,10,1096437012280807430
40,Twitter Web Client,"ExxonMobil’s Shawn Emerson Simmons, PhD, joined our CEO Darren Woods to announce our sponsorship of the Smithsonian… https://t.co/hq0CFFRuPS",,False,Thu Mar 14 17:24:55 +0000 2019,12,1106244829829349376
186,Twitter Web Client,"In our Corporate Strategic Research Lab’s 50-year history, a significant breakthrough is our advancement in the but… https://t.co/j2WdPF8UGt",,False,Thu Sep 06 16:11:45 +0000 2018,46,1037735112295768065
171,Twitter Web Client,"This #LaborDay, we celebrate our dedicated employees across the globe. Thank you for your hard work and commitment. https://t.co/zoQvBU9SU1",,False,Mon Sep 03 17:09:10 +0000 2018,50,1036662396495036416
39,Twitter Web Client,A cold draft can put a damper on a night in. Here’s a tip on how to stay warm while saving energy. https://t.co/GX2KPcn71K,,False,Thu Mar 07 16:32:48 +0000 2019,9,1103695001362579458
44,Twitter Web Client,How are engineers like Jamie #breakingboundaries? By thinking big. #WE18 👩‍🔬 https://t.co/tHQKxnA45l,,False,Thu Oct 18 23:26:39 +0000 2018,9,1053064848148439040
391,Twitter Web Client,Today we increased our estimate of the discovered recoverable resources for Stabroek Block offshore Guyana to more… https://t.co/TCiZnQXw8W,,False,Mon Jul 23 12:02:39 +0000 2018,176,1021364969366056960
119,Twitter Web Client,"ExxonMobil Chairman &amp; CEO speaks at World Gas Conference 2018

https://t.co/WVOLNImAUW",,False,Tue Jun 26 19:46:59 +0000 2018,51,1011697349536645121
314,Twitter Web Client,"We’ve partnered with @GlobalThermo, which is developing a way to catch carbon dioxide straight from the atmosphere… https://t.co/elxkxlDPhr",,False,Thu Jun 27 13:13:00 +0000 2019,97,1144232159684780033
137,Twitter Web Client,"⚡️ “2019 Annual Shareholder Meeting”

https://t.co/OCeQTga87l",,False,Wed May 29 15:49:12 +0000 2019,25,1133762221157355524
185,Twitter Web Client,"Together with @SABIC, we’re creating jobs and building a new facility as part of our Gulf Coast Growth Ventures Pro… https://t.co/8Luro7jWbl",,False,Thu Jun 13 13:15:08 +0000 2019,43,1139159268375093248
50,Twitter Web App,Congrats to @NoLimitsNate_ on a job well done in the @ninjawarrior National Finals! 🌟 #AmericanNinjaWarrior… https://t.co/qLH5wiBIsH,,False,Tue Sep 10 00:30:37 +0000 2019,11,1171219390907453445
52,Twitter for iPhone,Today our Chairman and CEO Darren Woods gives remarks at the 2019 ExxonMobil Annual Shareholder Meeting. Stay tuned… https://t.co/dP5VOzCAAO,,False,Wed May 29 13:37:26 +0000 2019,17,1133729061908488193
45,Twitter Web Client,"During #AsianPacificAmericanHeritageMonth, we’re celebrating our Asian Connection for Excellence (ACE) group, which… https://t.co/hIW1xWlRD0",,False,Fri May 31 14:28:43 +0000 2019,14,1134466744091889664
207,Twitter Web Client,Hitting the road this #LaborDayWeekend? Keep your windows closed when you’re driving 60 miles per hour or more. Ope… https://t.co/CeoGetYdFy,,False,Fri Aug 31 15:21:33 +0000 2018,72,1035548151753703425
94,Twitter Web App,"With advanced products and technology, we’re helping drivers reach their destinations more sustainably. https://t.co/C4zpWDNps0",,False,Tue Sep 24 16:10:29 +0000 2019,31,1176529345063636993
44,Twitter Web Client,Explore the biofuel potential of algae with one of our algae specialists and a promising young scientist. Watch mor… https://t.co/Kce44puCVk,,False,Thu Dec 06 15:44:15 +0000 2018,21,1070705486658527234
24,Twitter for iPhone,Find out more about groundbreaking research on genetic tools from our partner @SynGenomeInc here: https://t.co/AACWhP4w0d,,False,Tue Jul 10 00:47:55 +0000 2018,6,1016484123773362177
151,Twitter Web Client,"#Poll It’s summer, and you’re sweating. What’s a cool way to, well, stay cool this summer without maxing out your energy bill?",,False,Wed Jul 25 14:58:30 +0000 2018,18,1022133998267584513
43,Twitter Web Client,"From the desert to the strip, see how we’re working with a Las Vegas cab company to put our motor oils to the test. https://t.co/uNqgIUqlml",,False,Mon Feb 11 15:45:31 +0000 2019,8,1094985793712590850
117,Twitter Web Client,"From the Wright brothers’ use of Mobil oil lubricants, to its prevalence around the world today – our aviation fuel… https://t.co/DM2NmfUc4L",,False,Fri Nov 16 17:53:50 +0000 2018,20,1063490338873069570
39,Twitter Web Client,Tune in @XOM_NatGas at 4:30 P.M. EST when we’ll be live with leading women in the gas industry @WGC2018 discussing… https://t.co/TjhACUQptK,,False,Thu Jun 28 17:50:21 +0000 2018,13,1012392775411752960
302,Twitter Web Client,"We’re making a $2 billion investment to expand our Baytown chemical complex, creating 2,000 jobs. Learn more about… https://t.co/SnQPrMZ8Ty",,False,Thu May 02 18:17:04 +0000 2019,75,1124014959808122880
24,Twitter Web Client,The answer: unplug cooling units and other major appliances that can be an energy suck while you’re away. Turn them… https://t.co/UqTtkEF1ui,exxonmobil,False,Fri Sep 14 21:37:13 +0000 2018,6,1040716120829898753
206,Twitter Web Client,"How big is our Singapore expansion project? 800-ton reactor big. We moved the equipment 5,500km across Asia to help… https://t.co/GBUb7HQGoc",,False,Tue Oct 09 15:07:17 +0000 2018,50,1049677685830676482
148,Twitter Web Client,"As the F1 season kicks off, we’re giving you an inside look at the trackside lab of ExxonMobil technical advisors,… https://t.co/4b5DxHb1Kb",,False,Fri Mar 22 13:55:39 +0000 2019,39,1109091269442260992
55,Twitter Web Client,"Take a look inside Hebron, an engineering wonder helping to responsibly meet the world’s rising energy demand. https://t.co/5notzHAw0p",,False,Fri Dec 21 16:32:59 +0000 2018,31,1076153567994658816
19,Twitter for iPhone,"“ExxonMobil employees are a global community, responsibly developing the energy and products that improve people’s… https://t.co/cLDRRmqIiF",,False,Wed May 29 14:40:14 +0000 2019,9,1133744864393347073
28,Twitter Web Client,".@24hoursoflemans is the ultimate test of skill, character and @Mobil1 fluids. 🏁 Congrats to the @Toyota_Hybrid tea… https://t.co/faqSlqN31L",,False,Mon Jun 18 17:32:34 +0000 2018,12,1008764420309291012
90,Twitter Web Client,Energy jobs are in demand in Baton Rouge. See how our partnership with the @MyBRCC North Baton Rouge Industrial Tra… https://t.co/DfQT8cVdM9,,False,Wed Jan 09 15:24:50 +0000 2019,20,1083021788790079488
48,Twitter Web Client,Our investment in Gulf Coast manufacturing projects are expected to help create more than 45K jobs.… https://t.co/1fTWydiInL,,False,Tue Sep 25 15:32:08 +0000 2018,19,1044610511776681984
97,Twitter Web Client,See why we’re investing over $1 billion to expand our facilities in Rotterdam. https://t.co/6iW1gwS0ai,,False,Mon Jun 11 17:45:02 +0000 2018,30,1006230842518200321
456,Twitter Web Client,"Wrapping up @CERAWeek, our own Vijay Swarup will talk about the impactful role technology plays in addressing the d… https://t.co/bYJhc1ddD2",,False,Fri Mar 15 14:41:26 +0000 2019,36,1106566077448970240
38,Twitter Web Client,We rely on engineers like Moriah to solve complex problems and improve lives everywhere. #WE18 👩‍🔬 https://t.co/BaqGZXK5r3,,False,Fri Oct 19 20:04:32 +0000 2018,7,1053376370796122112
424,Twitter Web App,Congrats to M. Stanley Whittingham and his colleagues on winning the @NobelPrize in chemistry for their pioneering… https://t.co/LOpaMVGYqI,,False,Wed Oct 09 18:36:09 +0000 2019,102,1182001822220931073
116,Twitter Web Client,"It’s #NationalMentoringMonth and we’re spotlighting Larry Galloway, a retired employee who helps young people get j… https://t.co/hYVyDg7Rx1",,False,Wed Jan 23 15:55:36 +0000 2019,25,1088102961908195328
894,Twitter Web Client,XTO President Staale Gjervik spoke @CERAweek about our long-standing commitment to minimizing environmental impact… https://t.co/kstJWkQria,,False,Wed Mar 13 22:04:36 +0000 2019,102,1105952827032121346
27,Twitter for iPhone,Congratulations to the 11 grant winners! https://t.co/EM5529b8SQ,,False,Wed Mar 20 21:42:27 +0000 2019,10,1108483970189148163
10,Twitter Web Client,#Poll It’s laundry day and you want to save energy. What’s an easy way to cut a washer’s energy use in half?,,False,Mon Jul 09 14:30:08 +0000 2018,7,1016328656866693122
44,Twitter Web Client,Next pit stop on the Mobil 1™ Annual Protection 20K Road Trip? LA. Follow along to watch our drivers push @Mobil1 t… https://t.co/9Qarh2VeQH,,False,Mon Jul 16 16:00:31 +0000 2018,13,1018888117531676672
113,Twitter Web Client,"Another highlight from 50 years at our Corporate Strategic Research Lab? They’re small &amp; granular, and in some case… https://t.co/iGdyimq8Ar",,False,Tue Sep 04 20:26:03 +0000 2018,20,1037074334534250497
448,Twitter Web Client,"From getting dunked in water to finding a speedy escape, workers undergo rigorous training before even stepping foo… https://t.co/TDkwF2GSuc",,False,Wed Jul 03 13:54:08 +0000 2019,99,1146416840849219584
99,Twitter Web Client,"From helping drivers get the most out of their vehicles to transforming energy challenged regions of the world, our… https://t.co/5kKYsr8wr8",,False,Thu Feb 21 15:54:28 +0000 2019,21,1098611921920626688
206,Twitter Web Client,"Over the next 20 years, the number of electric cars will skyrocket. Find out how we're preparing for cars that don'… https://t.co/sXxul1arBh",,False,Tue Oct 30 13:45:07 +0000 2018,74,1057267155421593600
27,Twitter Web Client,Any potential regulatory adjustments won’t alter our stated commitment to reduce #methane emissions in our operatio… https://t.co/kHednjQ4FQ,,False,Thu Sep 13 15:41:34 +0000 2018,11,1040264230404902914
93,Twitter Web Client,“Our continued focus on long-term fundamentals and portfolio improvements position us well to grow shareholder valu… https://t.co/wQFgxXK6MN,,False,Fri Feb 01 15:47:49 +0000 2019,21,1091362491706286082
171,Twitter Web Client,#DYK most of your washing machine’s energy is used to heat the water? Detergents work just as well in colder temper… https://t.co/U9bo2958mm,,False,Wed Oct 10 16:33:05 +0000 2018,52,1050061667273465858
229,Twitter Web Client,"We’re dedicated to teaching women and girls. With @DiscoverEorg, @ExxonMobil hosts annual Introduce a Girl to Engin… https://t.co/bnA9O73E8c",,False,Thu Oct 11 15:59:33 +0000 2018,39,1050415616937607168
17,Twitter for iPhone,"“Last year, we set goals to reduce methane emissions by 15 percent and flaring by 25 percent.  We’re on track to me… https://t.co/KzmcdVBItR",,False,Wed May 29 14:44:24 +0000 2019,8,1133745915246850053
75,Twitter Web App,"If you’re looking to keep the energy bill down this summer, consider skipping the dryer and hanging your laundry on… https://t.co/XlYRG8R4fb",,False,Wed Sep 04 15:36:19 +0000 2019,13,1169272988593729537
36,Twitter Web Client,"In honor of #VeteransDay, meet a few veteran employees who discuss how their experience in the military has helped… https://t.co/sWXeEXEc9Z",,False,Mon Nov 12 15:15:07 +0000 2018,11,1062000847540928512
61,Twitter Web Client,We’re at #AspenIdeas talking about scaling up lower-emission energy solutions at the panel ‘Technologies Needed to… https://t.co/iiMLSwgqaa,,False,Fri Jun 28 15:45:06 +0000 2019,25,1144632824559034368
80,Twitter Web Client,"If you’re on candy duty tonight, turn your house lights off to avoid wasting energy. Instead, use decorative LEDs t… https://t.co/gJRWqHta1Q",,False,Wed Oct 31 19:34:53 +0000 2018,11,1057717566607646724
25,Twitter Web Client,Read our full statement regarding the New York Attorney General civil complaint. https://t.co/ME7VTW3xbC https://t.co/f1bPZ9Ang0,,False,Wed Oct 24 20:29:44 +0000 2018,21,1055194655007145984
103,Twitter Web Client,"Meet connected worker architect Eric Johnston, who uses #AR and wearable tech to help workers stay safe and collabo… https://t.co/zLoR7Yiy7v",,False,Tue Apr 02 15:56:53 +0000 2019,25,1113108047809953792
179,Twitter Web App,"We’re thankful for the contributions of our veterans. Today we spotlight our Veteran Advocacy and Support Team, an… https://t.co/2Qp8HEmooJ",,False,Mon Nov 11 18:21:24 +0000 2019,27,1193956911131037696
227,Twitter Web Client,"From aviation fuels and lubes to hydraulic fluids, our products and technology have played an integral role in help… https://t.co/9naeTgksOe",,False,Sun Aug 19 17:33:38 +0000 2018,41,1031232737183768577
73,Twitter Web Client,"To gear up for #WE18, we’re highlighting boundary-breaking engineers like Brighid. She’s an Americas products techn… https://t.co/BMJGNPmZfF",,False,Wed Oct 17 15:36:46 +0000 2018,11,1052584209720717313
147,Twitter Web Client,We’re testing new ways to grow algae together with @SynGenomeInc. The photosynthetic efficiency assay attempts to m… https://t.co/ChFK2wnv3D,,False,Tue Nov 20 16:18:53 +0000 2018,37,1064915995473657856
433,Twitter Web Client,"Contributing $43 billion to the GDP in 2017, our operations directly benefit the U.S. economy. https://t.co/gEOq3dvciN",,False,Fri May 03 16:35:16 +0000 2019,64,1124351729791905792
13,Twitter Web Client,CEO Darren Woods participated in the @business #NewEconForum Energy Challenges in the New Economies panel in Singap… https://t.co/qs7cam5x0J,,False,Wed Nov 07 16:15:39 +0000 2018,4,1060204139475619840
63,Twitter Web Client,"Whether you’re racing for a few hours or a few weeks, durable bike tires, seats, grips, performance clothing and sh… https://t.co/BdMTOkebKq",,False,Sat Jul 07 11:59:26 +0000 2018,19,1015565952921063430
56,Twitter Web Client,Our VP of R&amp;D Vijay Swarup spoke with @AmyAHarder @axios #AspenIdeas this morning about the role carbon capture and… https://t.co/MLursRlzM7,,False,Fri Jun 28 20:59:56 +0000 2019,16,1144712054076563462
83,Twitter Web Client,"#WE18 is in full swing as we continue to honor #boundarybreaking engineers at ExxonMobil. Today, we spotlight Chimm… https://t.co/z6iONmnk79",,False,Fri Oct 19 14:40:21 +0000 2018,21,1053294788924059648
35,Twitter for iPhone,"“We are well on our way to meeting the goals we laid out last year, doubling 2017 earnings potential by 2025, and g… https://t.co/mq0iT9ryTc",,False,Wed May 29 14:57:16 +0000 2019,15,1133749151014031361
71,Twitter Web Client,"Today, we announced our commitment of $10 million to the new Singapore Energy Center Partnership. The partnership w… https://t.co/GSeIYS7cdq",,False,Wed Oct 31 12:34:36 +0000 2018,9,1057611794976567301
213,Twitter Web Client,Learn how to increase your car’s fuel efficiency by making just one small change. #SmallChangesBigEfficiency https://t.co/4Ug7Q0EWnX,,False,Mon Sep 10 19:06:53 +0000 2018,69,1039228737865371653
263,Twitter Web Client,Today we announced our estimated third quarter 2018 earnings of $6.2 billion. https://t.co/P8DRD5axuz https://t.co/TklD8bBhmz,,False,Fri Nov 02 14:05:54 +0000 2018,69,1058359549189603329
326,Twitter Web App,"In honor of #WE19 we’re celebrating all our brilliant female engineers who break new ground all day, every day.… https://t.co/kN03IBtgbM",,False,Thu Nov 07 16:00:30 +0000 2019,52,1192471898266976256
291,Twitter Web App,"From uncovering new ways to protect the environment, to helping local businesses get involved, see how our operatio… https://t.co/JRSxH9ATEu",,False,Mon Sep 30 17:12:51 +0000 2019,42,1178719366487166976
95,Twitter Web Client,"At the @MyBRCC North Baton Rouge Industrial Training Initiative, students develop skills like welding and pipefitti… https://t.co/97YTfheccH",,False,Tue Jan 22 15:34:34 +0000 2019,18,1087735279782322176
72,Twitter Web Client,"This year’s #WE18 may be coming to an end, but we’re still supporting our brilliant and #boundarybreaking engineers… https://t.co/rpr8iv24IT",,False,Sat Oct 20 15:31:12 +0000 2018,9,1053669974760398849
384,Twitter Web Client,"Today, we celebrate the return of @NASA astronaut and former ExxonMobil employee @Astro_Feustel from @Space_Station… https://t.co/Jpf4TUOQEf",,False,Thu Oct 04 16:36:07 +0000 2018,60,1047888102499471360
199,Twitter Web Client,"As a part of our Growing the Gulf Initiative, today we announced construction on a new unit in our Beaumont, Texas… https://t.co/uDC7FyEJIn",,False,Tue Jan 29 18:12:29 +0000 2019,51,1090311737876860928
