favorite_count,source,text,in_reply_to_screen_name,is_retweet,created_at,retweet_count,id_str
87,Twitter Web Client,Watch Vijay Swarup join @IBM chairman @GinniRometty on the #CES2019 panel to discuss the roles of tech &amp; computing… https://t.co/TuytVmK1cH,,False,Tue Jan 08 20:40:41 +0000 2019,17,1082738886042939392
70,Twitter Web Client,Learn how we are producing the energy and products the world needs in a responsible manner. https://t.co/WwBp0dZen8 https://t.co/xukv78DivN,,False,Thu Oct 25 15:07:05 +0000 2018,18,1055475842057428992
208,Twitter Web Client,How much is ExxonMobil investing in the U.S. economy? $50B. https://t.co/pqAHXULVdb,,False,Tue Oct 16 16:18:18 +0000 2018,60,1052232275579072512
114,Twitter Ads,Learn how we deliver energy that fuels the world. #EnergyAwarenessMonth https://t.co/jzqQTQ5RT9,,False,Mon Oct 01 20:43:46 +0000 2018,36,1046863265366773761
75,Twitter Web Client,"For our next winter efficiency tip, we show why you should skip the warmup and just drive. https://t.co/TSeZ7IbQNR",,False,Thu Feb 28 16:28:21 +0000 2019,17,1101157167204306949
1270,Twitter Web Client,"From petri dish to pond to potential biofuel, watch how we are continuing our algae research in Calipatria, CA, wit… https://t.co/vLN2YbFGJr",,False,Thu Apr 18 14:32:40 +0000 2019,134,1118885060093140993
551,Twitter Web Client,"By 2025, thanks in part to newly discovered pockets of natural gas, new chemical projects across the U.S. are estim… https://t.co/SBIvgohZef",,False,Thu Sep 13 17:19:48 +0000 2018,155,1040288950601048066
86,Twitter Web App,What helps one car win the race? Find out through the eyes of a 9-year-old who’s eager to learn how oil helps cars… https://t.co/EHXPNiynj3,,False,Wed Aug 14 14:55:10 +0000 2019,20,1161652489667698689
124,Twitter Web Client,"To help fuel another phase of #biofuel research, @Clariant is partnering with @ExxonMobil and @REGbiofuels. They're… https://t.co/Q9nrCdgHrh",,False,Wed Jan 23 06:04:19 +0000 2019,59,1087954159792504834
261,Twitter Web Client,Meet just a few of the women around the world who inspire us. #InternationalWomensDay https://t.co/b22ymzvnNj,,False,Fri Mar 08 16:26:22 +0000 2019,82,1104055769111117824
625,Twitter Web Client,Ever wonder what life is like on one of the world’s largest offshore platforms? https://t.co/nNr4Bn87vL,,False,Tue Apr 09 15:15:06 +0000 2019,218,1115634245748297728
96,Twitter Web Client,Today we announced estimated second quarter 2018 earnings of $4 billion. https://t.co/r4ySfzsAWf https://t.co/l9gfavUd3u,,False,Fri Jul 27 14:53:04 +0000 2018,39,1022857406265606144
33,Twitter Web Client,Meet the Izod Pendulum Impact Tester – a swinging pendulum that tests a piece of plastic’s resistance to impact str… https://t.co/BEB8MsjMKQ,,False,Tue Jun 26 14:51:10 +0000 2018,11,1011622907213176832
577,Twitter Web App,"From hours in a lab to petri dishes, find out what it takes to research the world’s next big energy source. https://t.co/6dBH4FdatK",,False,Tue Aug 20 15:40:56 +0000 2019,68,1163838333073670145
75,Twitter Web Client,"Through our employee PRIDE network, ExxonMobil is energizing LGBTQ celebrations around the world. Check out a few o… https://t.co/0SykGBV1WS",,False,Mon Jun 24 20:40:52 +0000 2019,15,1143257708084301824
32,Twitter Web Client,Winter tip #1: Lowering your blinds can also lead to a lower heating bill. https://t.co/maGiGlZFxK,,False,Thu Feb 14 15:06:39 +0000 2019,7,1096063176871948288
60,Twitter Web Client,Always driving with a lot of stuff in your trunk? You may want to rethink that habit. #SmallChangesBigEfficiency https://t.co/j5yHR98lb2,,False,Mon Sep 24 17:40:49 +0000 2018,19,1044280507364708352
345,Twitter Web App,Our high-performance lubes are helping to power the future of energy in Asia. #SoothingScience https://t.co/q3Tn7IXmRl,,False,Wed Sep 18 15:23:36 +0000 2019,47,1174343217912930305
55,Twitter Web App,What can cookies &amp; milk teach us about the future of energy? Plenty. Watch the video to find out more. https://t.co/XA5gkoeWYb,,False,Fri Nov 22 17:18:12 +0000 2019,10,1197927271891382278
119,Twitter Web App,"Double, double toil and troubleshoot as we work to develop algae biofuel to scale. We’re celebrating… https://t.co/uunjikl1PN",,False,Fri Oct 25 15:38:17 +0000 2019,29,1187755265401204737
378,Twitter Web Client,Did you know we can reduce emissions at industrial sites by up to 90% with a process called carbon capture and stor… https://t.co/sZXB8tgtHc,,False,Mon May 20 14:25:50 +0000 2019,134,1130479749350985729
112,Twitter Web Client,"ExxonMobil Synergy delivered? It's possible with @startyoshi, an app-based mobile fuel and car service provider now… https://t.co/89xAjpg1f7",,False,Tue Aug 14 16:11:10 +0000 2018,29,1029400043869163520
2,Twitter Web App,@MSNBC @allinwithchris @msnbc Reports that claim we reached definitive conclusions about climate change decades bef… https://t.co/ZBwLwktd7P,MSNBC,False,Fri Sep 20 22:35:39 +0000 2019,0,1175176723513692163
642,Twitter Web App,It’s demo time at the School of ExxonMobil. We learned all about helium’s many uses and tested its lifting power wi… https://t.co/ruvtzvp1MN,,False,Fri Oct 11 15:00:54 +0000 2019,36,1182672429166010368
200,Twitter Web Client,See why protecting Guyana’s ecosystem is so important for responsible development in the country. https://t.co/Rv3DaXgYwO,,False,Wed Jun 19 16:17:23 +0000 2019,39,1141379459171442688
406,Twitter Web Client,"Today we announced our plans to join the Oil and Gas Climate Initiative, a voluntary initiative representing 13 of… https://t.co/gnxnexuAO9",,False,Thu Sep 20 14:07:06 +0000 2018,121,1042777173139116033
271,Twitter Web Client,CEO Darren Woods speaks at the #NewEconForum in Singapore about the “dual challenge” of meeting the world’s growing… https://t.co/SgSd3fBj8n,,False,Wed Nov 07 19:22:58 +0000 2018,32,1060251280097140736
130,Twitter Web Client,"In the past 40 years, we’ve become an industry leader in carbon capture. See why this technology is so important to… https://t.co/ozq8wpYJ39",,False,Mon Mar 25 16:23:13 +0000 2019,39,1110215570383949824
90,Twitter Web Client,Have an unbridled passion for chemistry? Join fellow chemists in our world-class facilities to advance industry-lea… https://t.co/GJLlIXUWe2,,False,Mon Oct 22 15:46:18 +0000 2018,14,1054398547192434688
